{
  "$schema": "http://json-schema.org/draft-07/schema#",
  "$id": "execution-friction-xray/output/v1",
  "title": "ExecutionFrictionXrayOutput",
  "description": "Structured execution friction analysis output: friction hotspots, critical path risks, ambiguities, a 7-day kill plan, and the single highest-leverage move — all grounded in transcript evidence.",
  "type": "object",
  "additionalProperties": false,
  "required": [
    "executive_summary",
    "friction_score",
    "friction_hotspots",
    "critical_path_risks",
    "ambiguities_to_resolve",
    "next_7_day_friction_kill_plan",
    "single_highest_leverage_move",
    "citations",
    "metadata"
  ],
  "properties": {
    "executive_summary": {
      "type": "string",
      "description": "2-4 sentence overview of the execution friction posture. Covers the most critical hotspots, the friction score rationale, and the single highest-leverage move."
    },
    "friction_score": {
      "type": "integer",
      "minimum": 0,
      "maximum": 100,
      "description": "Aggregate execution friction score. 0 = no friction, 100 = maximum friction. Based on count, severity, and blast radius of identified hotspots."
    },
    "friction_hotspots": {
      "type": "array",
      "minItems": 3,
      "items": {
        "$ref": "#/definitions/friction_hotspot"
      },
      "description": "Specific friction points that create execution drag. Each is categorized, scored, and grounded in transcript evidence."
    },
    "critical_path_risks": {
      "type": "array",
      "items": {
        "$ref": "#/definitions/critical_path_risk"
      },
      "description": "Risks that sit on the critical path and could block forward progress if not resolved."
    },
    "ambiguities_to_resolve": {
      "type": "array",
      "items": {
        "$ref": "#/definitions/ambiguity"
      },
      "description": "Unresolved ambiguities that will create friction if left unaddressed."
    },
    "next_7_day_friction_kill_plan": {
      "type": "array",
      "minItems": 3,
      "items": {
        "$ref": "#/definitions/kill_plan_action"
      },
      "description": "Concrete actions to reduce execution friction within the next 7 days. Each has an owner, due date, and proof artifact."
    },
    "single_highest_leverage_move": {
      "$ref": "#/definitions/highest_leverage_move",
      "description": "The one action that would most reduce execution friction if completed. Designed for an executive who can only do one thing."
    },
    "citations": {
      "type": "array",
      "minItems": 2,
      "items": {
        "$ref": "#/definitions/citation"
      },
      "description": "Verbatim quotes from the transcript that ground the analysis."
    },
    "metadata": {
      "$ref": "#/definitions/metadata",
      "description": "Analysis metadata: which input mode was used and when the output was generated."
    }
  },
  "definitions": {
    "friction_hotspot": {
      "type": "object",
      "additionalProperties": false,
      "required": [
        "id",
        "category",
        "title",
        "why_it_creates_drag",
        "severity",
        "likelihood",
        "blast_radius",
        "early_warning_signals",
        "evidence",
        "recommended_fix",
        "owner_recommendation",
        "target_resolution_window"
      ],
      "properties": {
        "id": {
          "type": "string",
          "description": "Unique identifier for this hotspot. Format: FH-001, FH-002, etc."
        },
        "category": {
          "type": "string",
          "enum": [
            "ownership",
            "dependency",
            "timeline",
            "scope",
            "decision_latency",
            "handoff",
            "resourcing",
            "signal_noise"
          ],
          "description": "Friction category. Determines the type of execution drag this hotspot creates."
        },
        "title": {
          "type": "string",
          "description": "Concise, specific title. Avoid generic labels — tie to concrete meeting content."
        },
        "why_it_creates_drag": {
          "type": "string",
          "description": "Explanation of the causal mechanism: what specifically slows execution and why."
        },
        "severity": {
          "type": "integer",
          "minimum": 1,
          "maximum": 5,
          "description": "Impact magnitude if this friction point is not resolved. 1 = minor inconvenience, 5 = blocks critical path."
        },
        "likelihood": {
          "type": "integer",
          "minimum": 1,
          "maximum": 5,
          "description": "Probability that this friction point will materialize or persist. 1 = very unlikely, 5 = near certain."
        },
        "blast_radius": {
          "type": "string",
          "enum": ["local", "cross_team", "org_wide"],
          "description": "Scope of impact. 'local' = single team. 'cross_team' = multiple teams. 'org_wide' = organization-level impact."
        },
        "early_warning_signals": {
          "type": "array",
          "items": {
            "type": "string"
          },
          "description": "Observable signals that this friction point is materializing. Specific enough to monitor."
        },
        "evidence": {
          "type": "array",
          "minItems": 1,
          "items": {
            "$ref": "#/definitions/evidence_entry"
          },
          "description": "Transcript evidence supporting this friction hotspot. At least one verbatim quote required."
        },
        "recommended_fix": {
          "type": "string",
          "description": "Specific, actionable fix. Not a restatement of the problem — a concrete step to reduce friction."
        },
        "owner_recommendation": {
          "type": "string",
          "description": "Who should own resolving this friction point, based on transcript context."
        },
        "target_resolution_window": {
          "type": "string",
          "description": "Recommended timeframe to resolve. Examples: '48 hours', 'this sprint', 'before Q4 launch'."
        }
      }
    },
    "evidence_entry": {
      "type": "object",
      "additionalProperties": false,
      "required": ["speaker", "quote", "approximate_location"],
      "properties": {
        "speaker": {
          "type": "string",
          "description": "Who said it."
        },
        "quote": {
          "type": "string",
          "description": "Verbatim quote from the transcript."
        },
        "approximate_location": {
          "type": "string",
          "description": "Where in the transcript this appears. Examples: 'early in discussion', 'during infrastructure review', 'closing remarks'."
        }
      }
    },
    "critical_path_risk": {
      "type": "object",
      "additionalProperties": false,
      "required": ["risk", "blocking_dependency", "owner", "due_or_trigger", "unblock_action"],
      "properties": {
        "risk": {
          "type": "string",
          "description": "What the critical path risk is."
        },
        "blocking_dependency": {
          "type": "string",
          "description": "What this risk depends on or is blocked by."
        },
        "owner": {
          "type": "string",
          "description": "Person or team responsible for unblocking."
        },
        "due_or_trigger": {
          "type": "string",
          "description": "When this must be resolved, or what event triggers it."
        },
        "unblock_action": {
          "type": "string",
          "description": "Specific action to unblock the dependency."
        }
      }
    },
    "ambiguity": {
      "type": "object",
      "additionalProperties": false,
      "required": ["ambiguity", "why_it_matters", "proposed_clarifying_question"],
      "properties": {
        "ambiguity": {
          "type": "string",
          "description": "The unresolved ambiguity stated clearly."
        },
        "why_it_matters": {
          "type": "string",
          "description": "What breaks or slows down if this ambiguity persists."
        },
        "proposed_clarifying_question": {
          "type": "string",
          "description": "A specific question that, if answered, would resolve the ambiguity."
        }
      }
    },
    "kill_plan_action": {
      "type": "object",
      "additionalProperties": false,
      "required": ["action", "owner", "due", "proof_artifact"],
      "properties": {
        "action": {
          "type": "string",
          "description": "Specific, executable task to reduce friction."
        },
        "owner": {
          "type": "string",
          "description": "Person responsible for completing this action."
        },
        "due": {
          "type": "string",
          "description": "When this action must be completed. Should be within 7 days."
        },
        "proof_artifact": {
          "type": "string",
          "description": "Tangible output that proves the action is complete."
        }
      }
    },
    "highest_leverage_move": {
      "type": "object",
      "additionalProperties": false,
      "required": ["move", "why", "owner", "deadline", "success_signal"],
      "properties": {
        "move": {
          "type": "string",
          "description": "The single most impactful action to reduce execution friction."
        },
        "why": {
          "type": "string",
          "description": "Why this move has the highest leverage — what it unblocks or accelerates."
        },
        "owner": {
          "type": "string",
          "description": "Who should execute this move."
        },
        "deadline": {
          "type": "string",
          "description": "By when this must be done to capture the leverage."
        },
        "success_signal": {
          "type": "string",
          "description": "Observable signal that the move succeeded."
        }
      }
    },
    "citation": {
      "type": "object",
      "additionalProperties": false,
      "required": ["quote", "speaker", "approximate_location"],
      "properties": {
        "quote": {
          "type": "string",
          "description": "Verbatim quote from the transcript."
        },
        "speaker": {
          "type": "string",
          "description": "Who said it."
        },
        "approximate_location": {
          "type": "string",
          "description": "Where in the transcript this appears."
        }
      }
    },
    "metadata": {
      "type": "object",
      "additionalProperties": false,
      "required": ["mode_used", "generated_at"],
      "properties": {
        "mode_used": {
          "type": "string",
          "enum": ["transcript_only", "transcript_plus_context"],
          "description": "Which input mode was detected. transcript_only if no optional context fields were provided; transcript_plus_context otherwise."
        },
        "generated_at": {
          "type": "string",
          "format": "date-time",
          "description": "ISO 8601 timestamp of when this analysis was generated."
        }
      }
    }
  }
}
